mysql> use da4;
Database changed
mysql> CREATE TABLE Projects (
    ->    id INT,
    ->    name VARCHAR(100),
    ->    assignedto VARCHAR(100),
    ->    start DATE,
    ->    end DATE
    -> );
Query OK, 0 rows affected (0.03 sec)

mysql> INSERT INTO Projects VALUES
    -> (1, 'Website Revamp', 'Alice', '2024-01-15', '2024-03-01'),
    -> (2, 'Mobile App', 'Bob', '2024-02-01', NULL),
    -> (3, 'Data Migration', NULL, NULL, NULL),
    -> (4, 'SEO Optimization', 'Eve', '2024-03-10', '2024-04-20'),
    -> (5, 'Cloud Migration', NULL, '2024-03-15', NULL);
Query OK, 5 rows affected (0.01 sec)
Records: 5  Duplicates: 0  Warnings: 0

mysql> SELECT*FROM PROJECTS;
+------+------------------+------------+------------+------------+
| id   | name             | assignedto | start      | end        |
+------+------------------+------------+------------+------------+
|    1 | Website Revamp   | Alice      | 2024-01-15 | 2024-03-01 |
|    2 | Mobile App       | Bob        | 2024-02-01 | NULL       |
|    3 | Data Migration   | NULL       | NULL       | NULL       |
|    4 | SEO Optimization | Eve        | 2024-03-10 | 2024-04-20 |
|    5 | Cloud Migration  | NULL       | 2024-03-15 | NULL       |
+------+------------------+------------+------------+------------+
5 rows in set (0.00 sec)

mysql> SELECT*FROM PROJECTS WHERE ASSIGNEDTO=NULL;
Empty set (0.00 sec)

mysql> SELECT*FROM PROJECTS WHERE ASSIGNEDTO IS NULL;
+------+-----------------+------------+------------+------+
| id   | name            | assignedto | start      | end  |
+------+-----------------+------------+------------+------+
|    3 | Data Migration  | NULL       | NULL       | NULL |
|    5 | Cloud Migration | NULL       | 2024-03-15 | NULL |
+------+-----------------+------------+------------+------+
2 rows in set (0.00 sec)

mysql> SELECT*FROM PROJECTS WHERE START IS NOT NULL;
+------+------------------+------------+------------+------------+
| id   | name             | assignedto | start      | end        |
+------+------------------+------------+------------+------------+
|    1 | Website Revamp   | Alice      | 2024-01-15 | 2024-03-01 |
|    2 | Mobile App       | Bob        | 2024-02-01 | NULL       |
|    4 | SEO Optimization | Eve        | 2024-03-10 | 2024-04-20 |
|    5 | Cloud Migration  | NULL       | 2024-03-15 | NULL       |
+------+------------------+------------+------------+------------+
4 rows in set (0.00 sec)

mysql> SELECT*FROM PROJECTS WHERE START IS NULL;
+------+----------------+------------+-------+------+
| id   | name           | assignedto | start | end  |
+------+----------------+------------+-------+------+
|    3 | Data Migration | NULL       | NULL  | NULL |
+------+----------------+------------+-------+------+
1 row in set (0.00 sec)

mysql> SELECT*FROM PROJECTS WHERE END IS NOT NULL;
+------+------------------+------------+------------+------------+
| id   | name             | assignedto | start      | end        |
+------+------------------+------------+------------+------------+
|    1 | Website Revamp   | Alice      | 2024-01-15 | 2024-03-01 |
|    4 | SEO Optimization | Eve        | 2024-03-10 | 2024-04-20 |
+------+------------------+------------+------------+------------+
2 rows in set (0.00 sec)

mysql> SELECT*FROM PROJECTS WHERE ASSIGNEDTO IS NOT NULL;
+------+------------------+------------+------------+------------+
| id   | name             | assignedto | start      | end        |
+------+------------------+------------+------------+------------+
|    1 | Website Revamp   | Alice      | 2024-01-15 | 2024-03-01 |
|    2 | Mobile App       | Bob        | 2024-02-01 | NULL       |
|    4 | SEO Optimization | Eve        | 2024-03-10 | 2024-04-20 |
+------+------------------+------------+------------+------------+
3 rows in set (0.00 sec)

mysql> UPDATE TABLE PROJECTS WHERE ASSIGNEDTO = FRANK WHERE ASSIGNEDTO IS NULL;
ERROR 1064 (42000): You have an error in your SQL syntax; check the manual that corresponds to your MySQL server version for the right syntax to use near 'TABLE PROJECTS WHERE ASSIGNEDTO = FRANK WHERE ASSIGNEDTO IS NULL' at line 1
mysql> UPDATE PROJECTS WHERE ASSIGNEDTO = FRANK WHERE ASSIGNEDTO IS NULL;
ERROR 1064 (42000): You have an error in your SQL syntax; check the manual that corresponds to your MySQL server version for the right syntax to use near 'WHERE ASSIGNEDTO = FRANK WHERE ASSIGNEDTO IS NULL' at line 1
mysql>  tee E:\mysql\my sql notes codegnan\Mysql day-10codegnan
mysql> UPDATE PROJECTS SET ASSIGNEDTO = 'FRANK' WHERE ASSIGNEDTO IS NULL;
Query OK, 2 rows affected (0.01 sec)
Rows matched: 2  Changed: 2  Warnings: 0

mysql> SELECT*FROM PROJECTS;
+------+------------------+------------+------------+------------+
| id   | name             | assignedto | start      | end        |
+------+------------------+------------+------------+------------+
|    1 | Website Revamp   | Alice      | 2024-01-15 | 2024-03-01 |
|    2 | Mobile App       | Bob        | 2024-02-01 | NULL       |
|    3 | Data Migration   | FRANK      | NULL       | NULL       |
|    4 | SEO Optimization | Eve        | 2024-03-10 | 2024-04-20 |
|    5 | Cloud Migration  | FRANK      | 2024-03-15 | NULL       |
+------+------------------+------------+------------+------------+
5 rows in set (0.00 sec)

mysql> UPDATE PROJECTS SET START=CURDATE() WHERE START IS NULL;
Query OK, 1 row affected (0.01 sec)
Rows matched: 1  Changed: 1  Warnings: 0

mysql> SELECT*FROM PROJECTS;
+------+------------------+------------+------------+------------+
| id   | name             | assignedto | start      | end        |
+------+------------------+------------+------------+------------+
|    1 | Website Revamp   | Alice      | 2024-01-15 | 2024-03-01 |
|    2 | Mobile App       | Bob        | 2024-02-01 | NULL       |
|    3 | Data Migration   | FRANK      | 2026-07-23 | NULL       |
|    4 | SEO Optimization | Eve        | 2024-03-10 | 2024-04-20 |
|    5 | Cloud Migration  | FRANK      | 2024-03-15 | NULL       |
+------+------------------+------------+------------+------------+
5 rows in set (0.00 sec)

mysql> UPDATE PROJECTS SET NAME='COMPLETED' WHERE END IS NOT NULL;
Query OK, 2 rows affected (0.01 sec)
Rows matched: 2  Changed: 2  Warnings: 0

mysql> SELECT*FROM PROJECTS;
+------+-----------------+------------+------------+------------+
| id   | name            | assignedto | start      | end        |
+------+-----------------+------------+------------+------------+
|    1 | COMPLETED       | Alice      | 2024-01-15 | 2024-03-01 |
|    2 | Mobile App      | Bob        | 2024-02-01 | NULL       |
|    3 | Data Migration  | FRANK      | 2026-07-23 | NULL       |
|    4 | COMPLETED       | Eve        | 2024-03-10 | 2024-04-20 |
|    5 | Cloud Migration | FRANK      | 2024-03-15 | NULL       |
+------+-----------------+------------+------------+------------+
5 rows in set (0.00 sec)

mysql> delete from projects where assignedto is null;
Query OK, 0 rows affected (0.00 sec)

mysql> delete from projects where start is null;
Query OK, 0 rows affected (0.00 sec)

mysql> delete from projects where end is not null;
Query OK, 2 rows affected (0.01 sec)

mysql> SELECT*FROM PROJECTS;
+------+-----------------+------------+------------+------+
| id   | name            | assignedto | start      | end  |
+------+-----------------+------------+------------+------+
|    2 | Mobile App      | Bob        | 2024-02-01 | NULL |
|    3 | Data Migration  | FRANK      | 2026-07-23 | NULL |
|    5 | Cloud Migration | FRANK      | 2024-03-15 | NULL |
+------+-----------------+------------+------------+------+
3 rows in set (0.00 sec)

mysql> tee E:\mysql\my sql notes codegnan\Mysql day-10codegnan.txt
